{
  "type": "event",
  "seq": 512,
  "session_id": "sess_view_state_example",
  "server_time_ms": 1743210400000,
  "payload": {
    "event_type": "player_move",
    "round_index": 4,
    "turn_index": 2,
    "acting_player_id": 2,
    "acting_player_id_alias_role": "legacy_compatibility_alias",
    "acting_primary_player_id": "ply_public_2",
    "acting_primary_player_id_source": "public",
    "acting_legacy_player_id": 2,
    "acting_seat_index": 2,
    "acting_turn_order_index": 2,
    "acting_player_label": "P2",
    "acting_public_player_id": "ply_public_2",
    "acting_seat_id": "seat_public_2",
    "acting_viewer_id": "viewer_public_2",
    "from_tile_index": 3,
    "to_tile_index": 9,
    "path": [4, 5, 6, 7, 8, 9],
    "view_state": {
      "reveals": {
        "round_index": 4,
        "turn_index": 2,
        "items": [
          {
            "seq": 510,
            "event_code": "weather_reveal",
            "event_order": 10,
            "tone": "effect",
            "focus_tile_index": null,
            "is_interrupt": true
          },
          {
            "seq": 511,
            "event_code": "dice_roll",
            "event_order": 20,
            "tone": "move",
            "focus_tile_index": null,
            "is_interrupt": false
          },
          {
            "seq": 512,
            "event_code": "player_move",
            "event_order": 30,
            "tone": "move",
            "focus_tile_index": 9,
            "is_interrupt": false
          }
        ]
      },
      "board": {
        "last_move": {
          "player_id": 2,
          "from_tile_index": 3,
          "to_tile_index": 9,
          "path_tile_indices": [4, 5, 6, 7, 8, 9]
        }
      }
    }
  }
}
